{
  "schema_version": "ramshared-spec-evidence/v1",
  "slug": "benchmark-evidence-integrity",
  "status": "PARTIAL",
  "spec": {
    "path": "docs/specs/no-milestone/benchmark-evidence-integrity/SPEC.md",
    "sha256": "b31559050a31b145cf47c2882d23649edb93e02e6e09df6897a16727ef07e2f6"
  },
  "tests": [
    {
      "name": "valid_v1_record_passes",
      "path": "tools/ci/check-benchmark-evidence.test.mjs",
      "kind": "unit",
      "exit_code": 0
    },
    {
      "name": "complete_done_manifest_passes",
      "path": "tools/ci/check-spec-evidence.test.mjs",
      "kind": "unit",
      "exit_code": 0
    },
    {
      "name": "monitor_benchmark_rejects_legacy_unqualified_status",
      "path": "crates/ramshared-cli/src/monitor.rs",
      "kind": "unit",
      "exit_code": 0
    },
    {
      "name": "monitor_benchmark_accepts_promotable_v1_evidence",
      "path": "crates/ramshared-cli/src/monitor.rs",
      "kind": "unit",
      "exit_code": 0
    },
    {
      "name": "monitor_benchmark_rejects_nonpromotable_evidence",
      "path": "crates/ramshared-cli/src/monitor.rs",
      "kind": "unit",
      "exit_code": 0
    },
    {
      "name": "monitor_benchmark_rejects_dirty_or_incomplete_evidence",
      "path": "crates/ramshared-cli/src/monitor.rs",
      "kind": "unit",
      "exit_code": 0
    }
  ],
  "cover": [
    {
      "path": "tools/ci/check-benchmark-evidence.mjs",
      "classification": "N/A — Node unit-tested",
      "justification": "The benchmark validator is zero-dependency Node logic covered by named unit and refusal fixtures."
    },
    {
      "path": "tools/ci/check-spec-evidence.mjs",
      "classification": "N/A — Node unit-tested",
      "justification": "The claim validator is zero-dependency Node logic covered by named unit and refusal fixtures."
    },
    {
      "path": "crates/ramshared-cli/src/monitor.rs",
      "line_percent": 88.7,
      "evidence": "EVD-0086; 2,033 of 2,292 lines"
    }
  ],
  "live": {
    "required": true,
    "before": {
      "legacy_fixture_verdict": "PASS_ZERO_PANIC",
      "installed_dashboard": "0.14.1, old parser"
    },
    "action": {
      "commands": [
        "cargo test -p ramshared-cli -j 1 monitor_benchmark_",
        "cargo test -p ramshared-cli -j 1",
        "cargo clippy -p ramshared-cli --all-targets -- -D warnings",
        "node tools/ci/check-rust-slice-coverage.mjs -p ramshared-cli --files crates/ramshared-cli/src/monitor.rs --min 80"
      ]
    },
    "after": {
      "source_tests": "4 passed; full CLI: 345 unit + 10 dispatch passed",
      "legacy_fixture_verdict": "AWAITING_QUALIFICATION",
      "installed_dashboard": "still 0.14.1; new parser not deployed"
    },
    "legitimate": {
      "verdict": "PASS",
      "scope": "promotable v1 parser fixture only"
    },
    "refusals": [
      {
        "name": "legacy unqualified Build #5 record",
        "verdict": "PASS"
      },
      {
        "name": "non-promotable evidence",
        "verdict": "PASS"
      },
      {
        "name": "dirty or incomplete evidence",
        "verdict": "PASS"
      },
      {
        "name": "forged metric summaries",
        "verdict": "PASS"
      }
    ],
    "cleanup": {
      "complete": true,
      "residue": 0
    },
    "evidence_artifacts": [
      "docs/specs/no-milestone/benchmark-evidence-integrity/evidence/validation-summary.json"
    ]
  },
  "binary_match": {
    "required": true,
    "passed": false,
    "identities": []
  },
  "artifacts": [
    {
      "path": "docs/specs/no-milestone/benchmark-evidence-integrity/evidence/validation-summary.json",
      "bytes": 550,
      "sha256": "2252c540a792aba5fc8de74a0ea84ae2b861fa62e84390750c97e88c058d4375"
    }
  ],
  "validation_path": "validation.md",
  "impl_path": "docs/specs/no-milestone/benchmark-evidence-integrity/IMPL.md",
  "gaps": {
    "open": [],
    "env_bound": [
      {
        "blocker": "The corrected dashboard source has not been built and installed in the deployment environment, so its live process identity remains unverified.",
        "next_proof": "Build and install the exact source revision, verify BINARY_MATCH, and capture deployed before/action/after output showing the legacy record remains AWAITING_QUALIFICATION."
      }
    ]
  },
  "rollback_trigger": "one invalid claim or sensitive diagnostic passes the public gate"
}
